{
  "object_code": "GRP000001",
  "name": "Cyclic Group",
  "notation": ["C_n", "Z/nZ"],
  "type": "group",
  "definition": "A cyclic group is a group generated by a single element such that every element of the group can be expressed as a power of that generator.",
  "defining_equations": [
    {
      "latex": "\\langle a \\mid a^n = e \\rangle",
      "explanation": "a is the generator, n is the order of the group, and e is the identity element. The relation a^n = e means that applying the generator n times returns the identity element."
    },
    {
      "latex": "C_n = \\{e, a, a^2, \\dots, a^{n-1}\\}",
      "explanation": "This represents all elements of the cyclic group. Each element is obtained by repeated application of the generator a, and the sequence wraps around after n steps."
    }
  ],
  "visuals": [
    {
      "type": "cayley_graph",
      "description": "The Cayley graph of a cyclic group shows its elements arranged in a circle. Each directed edge corresponds to applying the generator, so moving along edges cycles through all elements and returns to the starting point.",
      "image_url": "/visuals/cyclic-group-c5.svg",
      "caption": "Cayley graph of a cyclic group, showing cyclic structure.",
      "query": [
        "C5 Cayley graph labeled cycle directed",
        "cyclic group graph nodes circle arrows group theory"
      ]
    }
  ],
  "origin_history": "Cyclic groups emerged from the study of modular arithmetic and periodic phenomena. These ideas were formalized during the development of abstract algebra in the 18th and 19th centuries. Work by Carl Friedrich Gauss on congruences and roots of unity played a foundational role in shaping the modern concept of cyclic groups.",
  "importance": "Cyclic groups are fundamental in algebra because they form the simplest class of groups and serve as building blocks for more complex structures. A key result states that every finite abelian group can be decomposed into a direct product of cyclic groups, which makes them central to classification problems in group theory.\n\nThey are widely used in applications such as cryptography, signal processing, coding theory, and modular arithmetic. In cryptography, cyclic groups underlie protocols such as Diffie-Hellman key exchange. In signal processing and Fourier analysis, cyclic structures model periodic behavior and enable efficient computation.",
  "research_trends": "Cyclic groups play an important role in modern machine learning through group-equivariant neural networks, where symmetry constraints are incorporated directly into model architectures. These approaches improve generalization and reduce the number of parameters required to learn structured patterns.\n\nAnother active research direction involves spectral and Fourier-based learning, where cyclic structures enable efficient representation of periodic signals. These methods are increasingly used in scientific machine learning, physics simulations, and large-scale structured data analysis.",
  "intuition": "A cyclic group behaves like a clock. Starting from one element and repeatedly applying the same operation moves through all elements and eventually returns to the starting point.",
  "minimal_example": "C5 = {0, 1, 2, 3, 4} under addition modulo 5. For example, 3 + 4 congruent to 2 modulo 5, showing how the structure wraps around.",
  "code_snippet": {
    "language": "python",
    "code": "n = 5\ndef op(a, b):\n    return (a + b) % n\n\nprint(op(3, 4))"
  },
  "connections": [
    { "to": "Modular Arithmetic", "type": "based_on" },
    { "to": "Roots of Unity", "type": "leads_to" },
    { "to": "Fourier Matrix", "type": "enables" },
    { "to": "Discrete Fourier Transform", "type": "related_to" }
  ],
  "variants": [
    "Infinite cyclic group Z",
    "Finite cyclic group C_n",
    "Direct product of cyclic groups",
    "Cyclic codes"
  ],
  "core_properties": [
    "Abelian",
    "Generated by one element",
    "Order n in the finite case",
    "Exactly one subgroup for each divisor of n"
  ],
  "level": "Beginner to intermediate",
  "tags": [
    "group theory",
    "algebra",
    "modular arithmetic",
    "symmetry",
    "Fourier analysis"
  ],
  "citations": [
    {
      "type": "web",
      "icon": "web",
      "title": "Cyclic Group, Wolfram MathWorld",
      "url": "https://mathworld.wolfram.com/CyclicGroup.html"
    },
    {
      "type": "web",
      "icon": "web",
      "title": "Cyclic Group, Wikipedia",
      "url": "https://en.wikipedia.org/wiki/Cyclic_group"
    },
    {
      "type": "book",
      "icon": "book",
      "title": "Abstract Algebra by Dummit and Foote"
    }
  ],
  "resources": [
    {
      "type": "video",
      "icon": "video",
      "title": "3Blue1Brown group theory introduction",
      "url": "https://www.youtube.com/watch?v=mH0oCDa74tE"
    },
    {
      "type": "paper",
      "icon": "paper",
      "title": "Group Equivariant Convolutional Networks",
      "url": "https://arxiv.org/abs/1602.07576"
    },
    {
      "type": "code",
      "icon": "code",
      "title": "e2cnn GitHub repository",
      "url": "https://github.com/QUVA-Lab/e2cnn"
    }
  ]
}
